root@lamp-s-1vcpu-1gb-tor1-01:~# tcpdump -i eth0 dst 173.206.219.44
tcpdump: verbose output suppressed, use -v or -vv for full protocol decode
listening on eth0, link-type EN10MB (Ethernet), capture size 262144 bytes
04:29:49.631625 IP lamp-s-1vcpu-1gb-tor1-01.ssh > dsl-173-206-219-44.tor.primus.ca.54505: Flags [P.], seq 1470340726:1470340834, ack 2641386595, win 319, length 108
04:29:49.631724 IP lamp-s-1vcpu-1gb-tor1-01.ssh > dsl-173-206-219-44.tor.primus.ca.54505: Flags [P.], seq 108:144, ack 1, win 319, length 36
04:29:49.631848 IP lamp-s-1vcpu-1gb-tor1-01.ssh > dsl-173-206-219-44.tor.primus.ca.54505: Flags [P.], seq 144:252, ack 1, win 319, length 108
04:29:49.631922 IP lamp-s-1vcpu-1gb-tor1-01.ssh > dsl-173-206-219-44.tor.primus.ca.54505: Flags [P.], seq 252:288, ack 1, win 319, length 36
04:29:49.633796 IP lamp-s-1vcpu-1gb-tor1-01.ssh > dsl-173-206-219-44.tor.primus.ca.54505: Flags [P.], seq 288:492, ack 1, win 319, length 204
04:29:49.633885 IP lamp-s-1vcpu-1gb-tor1-01.ssh > dsl-173-206-219-44.tor.primus.ca.54505: Flags [P.], seq 492:528, ack 1, win 319, length 36
04:29:49.633992 IP lamp-s-1vcpu-1gb-tor1-01.ssh > dsl-173-206-219-44.tor.primus.ca.54505: Flags [P.], seq 528:708, ack 1, win 319, length 180
04:29:49.634067 IP lamp-s-1vcpu-1gb-tor1-01.ssh > dsl-173-206-219-44.tor.primus.ca.54505: Flags [P.], seq 708:744, ack 1, win 319, length 36
04:29:49.634164 IP lamp-s-1vcpu-1gb-tor1-01.ssh > dsl-173-206-219-44.tor.primus.ca.54505: Flags [P.], seq 744:924, ack 1, win 319, length 180
04:29:49.668384 IP lamp-s-1vcpu-1gb-tor1-01.ssh > dsl-173-206-219-44.tor.primus.ca.54505: Flags [P.], seq 924:2256, ack 1, win 319, length 1332
04:29:49.668675 IP lamp-s-1vcpu-1gb-tor1-01.ssh > dsl-173-206-219-44.tor.primus.ca.54505: Flags [P.], seq 2256:2436, ack 1, win 319, length 180
04:29:49.668819 IP lamp-s-1vcpu-1gb-tor1-01.ssh > dsl-173-206-219-44.tor.primus.ca.54505: Flags [P.], seq 2436:2472, ack 1, win 319, length 36
04:29:49.668932 IP lamp-s-1vcpu-1gb-tor1-01.ssh > dsl-173-206-219-44.tor.primus.ca.54505: Flags [P.], seq 2472:2652, ack 1, win 319, length 180
04:29:49.670477 IP lamp-s-1vcpu-1gb-tor1-01.ssh > dsl-173-206-219-44.tor.primus.ca.54505: Flags [P.], seq 2652:3120, ack 1, win 319, length 468
04:29:49.670658 IP lamp-s-1vcpu-1gb-tor1-01.ssh > dsl-173-206-219-44.tor.primus.ca.54505: Flags [P.], seq 3120:3300, ack 1, win 319, length 180
04:29:49.670800 IP lamp-s-1vcpu-1gb-tor1-01.ssh > dsl-173-206-219-44.tor.primus.ca.54505: Flags [P.], seq 3300:3336, ack 1, win 319, length 36
04:29:49.670911 IP lamp-s-1vcpu-1gb-tor1-01.ssh > dsl-173-206-219-44.tor.primus.ca.54505: Flags [P.], seq 3336:3516, ack 1, win 319, length 180
04:29:49.670988 IP lamp-s-1vcpu-1gb-tor1-01.ssh > dsl-173-206-219-44.tor.primus.ca.54505: Flags [P.], seq 3516:3552, ack 1, win 319, length 36
04:29:49.671085 IP lamp-s-1vcpu-1gb-tor1-01.ssh > dsl-173-206-219-44.tor.primus.ca.54505: Flags [P.], seq 3552:3732, ack 1, win 319, length 180
04:29:49.671183 IP lamp-s-1vcpu-1gb-tor1-01.ssh > dsl-173-206-219-44.tor.primus.ca.54505: Flags [P.], seq 3732:3768, ack 1, win 319, length 36
04:29:49.671329 IP lamp-s-1vcpu-1gb-tor1-01.ssh > dsl-173-206-219-44.tor.primus.ca.54505: Flags [P.], seq 3768:3948, ack 1, win 319, length 180
04:29:49.672430 IP lamp-s-1vcpu-1gb-tor1-01.ssh > dsl-173-206-219-44.tor.primus.ca.54505: Flags [P.], seq 3948:4848, ack 1, win 319, length 900
04:29:49.672612 IP lamp-s-1vcpu-1gb-tor1-01.ssh > dsl-173-206-219-44.tor.primus.ca.54505: Flags [P.], seq 4848:5028, ack 1, win 319, length 180
04:29:49.672693 IP lamp-s-1vcpu-1gb-tor1-01.ssh > dsl-173-206-219-44.tor.primus.ca.54505: Flags [P.], seq 5028:5064, ack 1, win 319, length 36
04:29:49.672792 IP lamp-s-1vcpu-1gb-tor1-01.ssh > dsl-173-206-219-44.tor.primus.ca.54505: Flags [P.], seq 5064:5244, ack 1, win 319, length 180
04:29:49.672865 IP lamp-s-1vcpu-1gb-tor1-01.ssh > dsl-173-206-219-44.tor.primus.ca.54505: Flags [P.], seq 5244:5280, ack 1, win 319, length 36
04:29:49.672959 IP lamp-s-1vcpu-1gb-tor1-01.ssh > dsl-173-206-219-44.tor.primus.ca.54505: Flags [P.], seq 5280:5460, ack 1, win 319, length 180
04:29:49.673033 IP lamp-s-1vcpu-1gb-tor1-01.ssh > dsl-173-206-219-44.tor.primus.ca.54505: Flags [P.], seq 5460:5496, ack 1, win 319, length 36
04:29:49.673171 IP lamp-s-1vcpu-1gb-tor1-01.ssh > dsl-173-206-219-44.tor.primus.ca.54505: Flags [P.], seq 5496:5676, ack 1, win 319, length 180
04:29:49.707373 IP lamp-s-1vcpu-1gb-tor1-01.ssh > dsl-173-206-219-44.tor.primus.ca.54505: Flags [P.], seq 5676:6576, ack 1, win 319, length 900
04:29:49.707631 IP lamp-s-1vcpu-1gb-tor1-01.ssh > dsl-173-206-219-44.tor.primus.ca.54505: Flags [P.], seq 6576:6756, ack 1, win 319, length 180
04:29:49.707722 IP lamp-s-1vcpu-1gb-tor1-01.ssh > dsl-173-206-219-44.tor.primus.ca.54505: Flags [P.], seq 6756:6792, ack 1, win 319, length 36
04:29:49.707825 IP lamp-s-1vcpu-1gb-tor1-01.ssh > dsl-173-206-219-44.tor.primus.ca.54505: Flags [P.], seq 6792:6972, ack 1, win 319, length 180
04:29:49.709430 IP lamp-s-1vcpu-1gb-tor1-01.ssh > dsl-173-206-219-44.tor.primus.ca.54505: Flags [P.], seq 6972:7440, ack 1, win 319, length 468
04:29:49.709578 IP lamp-s-1vcpu-1gb-tor1-01.ssh > dsl-173-206-219-44.tor.primus.ca.54505: Flags [P.], seq 7440:7620, ack 1, win 319, length 180
04:29:49.709691 IP lamp-s-1vcpu-1gb-tor1-01.ssh > dsl-173-206-219-44.tor.primus.ca.54505: Flags [P.], seq 7620:7656, ack 1, win 319, length 36
04:29:49.709864 IP lamp-s-1vcpu-1gb-tor1-01.ssh > dsl-173-206-219-44.tor.primus.ca.54505: Flags [P.], seq 7656:7836, ack 1, win 319, length 180
04:29:49.709989 IP lamp-s-1vcpu-1gb-tor1-01.ssh > dsl-173-206-219-44.tor.primus.ca.54505: Flags [P.], seq 7836:7872, ack 1, win 319, length 36
04:29:49.710155 IP lamp-s-1vcpu-1gb-tor1-01.ssh > dsl-173-206-219-44.tor.primus.ca.54505: Flags [P.], seq 7872:8052, ack 1, win 319, length 180
04:29:49.710241 IP lamp-s-1vcpu-1gb-tor1-01.ssh > dsl-173-206-219-44.tor.primus.ca.54505: Flags [P.], seq 8052:8088, ack 1, win 319, length 36
04:29:49.710343 IP lamp-s-1vcpu-1gb-tor1-01.ssh > dsl-173-206-219-44.tor.primus.ca.54505: Flags [P.], seq 8088:8268, ack 1, win 319, length 180
04:29:49.711363 IP lamp-s-1vcpu-1gb-tor1-01.ssh > dsl-173-206-219-44.tor.primus.ca.54505: Flags [P.], seq 8268:9168, ack 1, win 319, length 900
04:29:49.711497 IP lamp-s-1vcpu-1gb-tor1-01.ssh > dsl-173-206-219-44.tor.primus.ca.54505: Flags [P.], seq 9168:9348, ack 1, win 319, length 180
04:29:49.711575 IP lamp-s-1vcpu-1gb-tor1-01.ssh > dsl-173-206-219-44.tor.primus.ca.54505: Flags [P.], seq 9348:9384, ack 1, win 319, length 36
04:29:49.711670 IP lamp-s-1vcpu-1gb-tor1-01.ssh > dsl-173-206-219-44.tor.primus.ca.54505: Flags [P.], seq 9384:9564, ack 1, win 319, length 180
04:29:49.711776 IP lamp-s-1vcpu-1gb-tor1-01.ssh > dsl-173-206-219-44.tor.primus.ca.54505: Flags [P.], seq 9564:9744, ack 1, win 319, length 180
04:29:49.711936 IP lamp-s-1vcpu-1gb-tor1-01.ssh > dsl-173-206-219-44.tor.primus.ca.54505: Flags [P.], seq 9744:10076, ack 1, win 319, length 332
04:29:49.712050 IP lamp-s-1vcpu-1gb-tor1-01.ssh > dsl-173-206-219-44.tor.primus.ca.54505: Flags [P.], seq 10076:10256, ack 1, win 319, length 180
04:29:49.712159 IP lamp-s-1vcpu-1gb-tor1-01.ssh > dsl-173-206-219-44.tor.primus.ca.54505: Flags [P.], seq 10256:10444, ack 1, win 319, length 188
04:29:49.713371 IP lamp-s-1vcpu-1gb-tor1-01.ssh > dsl-173-206-219-44.tor.primus.ca.54505: Flags [P.], seq 10444:10632, ack 1, win 319, length 188
04:29:49.713544 IP lamp-s-1vcpu-1gb-tor1-01.ssh > dsl-173-206-219-44.tor.primus.ca.54505: Flags [P.], seq 10632:10820, ack 1, win 319, length 188
04:29:49.713672 IP lamp-s-1vcpu-1gb-tor1-01.ssh > dsl-173-206-219-44.tor.primus.ca.54505: Flags [P.], seq 10820:11008, ack 1, win 319, length 188
04:29:49.713781 IP lamp-s-1vcpu-1gb-tor1-01.ssh > dsl-173-206-219-44.tor.primus.ca.54505: Flags [P.], seq 11008:11196, ack 1, win 319, length 188
04:29:49.715293 IP lamp-s-1vcpu-1gb-tor1-01.ssh > dsl-173-206-219-44.tor.primus.ca.54505: Flags [P.], seq 11196:11384, ack 1, win 319, length 188
04:29:49.715475 IP lamp-s-1vcpu-1gb-tor1-01.ssh > dsl-173-206-219-44.tor.primus.ca.54505: Flags [P.], seq 11384:11572, ack 1, win 319, length 188
04:29:49.715604 IP lamp-s-1vcpu-1gb-tor1-01.ssh > dsl-173-206-219-44.tor.primus.ca.54505: Flags [P.], seq 11572:11760, ack 1, win 319, length 188
04:29:49.715715 IP lamp-s-1vcpu-1gb-tor1-01.ssh > dsl-173-206-219-44.tor.primus.ca.54505: Flags [P.], seq 11760:11948, ack 1, win 319, length 188
04:29:49.715822 IP lamp-s-1vcpu-1gb-tor1-01.ssh > dsl-173-206-219-44.tor.primus.ca.54505: Flags [P.], seq 11948:12136, ack 1, win 319, length 188
04:29:49.715929 IP lamp-s-1vcpu-1gb-tor1-01.ssh > dsl-173-206-219-44.tor.primus.ca.54505: Flags [P.], seq 12136:12324, ack 1, win 319, length 188
04:29:49.716037 IP lamp-s-1vcpu-1gb-tor1-01.ssh > dsl-173-206-219-44.tor.primus.ca.54505: Flags [P.], seq 12324:12512, ack 1, win 319, length 188
04:29:49.716147 IP lamp-s-1vcpu-1gb-tor1-01.ssh > dsl-173-206-219-44.tor.primus.ca.54505: Flags [P.], seq 12512:12700, ack 1, win 319, length 188
04:29:49.717283 IP lamp-s-1vcpu-1gb-tor1-01.ssh > dsl-173-206-219-44.tor.primus.ca.54505: Flags [P.], seq 12700:12888, ack 1, win 319, length 188
04:29:49.717445 IP lamp-s-1vcpu-1gb-tor1-01.ssh > dsl-173-206-219-44.tor.primus.ca.54505: Flags [P.], seq 12888:13076, ack 1, win 319, length 188
04:29:49.717564 IP lamp-s-1vcpu-1gb-tor1-01.ssh > dsl-173-206-219-44.tor.primus.ca.54505: Flags [P.], seq 13076:13264, ack 1, win 319, length 188
04:29:49.717672 IP lamp-s-1vcpu-1gb-tor1-01.ssh > dsl-173-206-219-44.tor.primus.ca.54505: Flags [P.], seq 13264:13452, ack 1, win 319, length 188
04:29:49.717780 IP lamp-s-1vcpu-1gb-tor1-01.ssh > dsl-173-206-219-44.tor.primus.ca.54505: Flags [P.], seq 13452:13640, ack 1, win 319, length 188
04:29:49.717887 IP lamp-s-1vcpu-1gb-tor1-01.ssh > dsl-173-206-219-44.tor.primus.ca.54505: Flags [P.], seq 13640:13828, ack 1, win 319, length 188
04:29:49.717994 IP lamp-s-1vcpu-1gb-tor1-01.ssh > dsl-173-206-219-44.tor.primus.ca.54505: Flags [P.], seq 13828:14016, ack 1, win 319, length 188
04:29:49.718102 IP lamp-s-1vcpu-1gb-tor1-01.ssh > dsl-173-206-219-44.tor.primus.ca.54505: Flags [P.], seq 14016:14204, ack 1, win 319, length 188
04:29:49.746224 IP lamp-s-1vcpu-1gb-tor1-01.ssh > dsl-173-206-219-44.tor.primus.ca.54505: Flags [P.], seq 14204:14392, ack 1, win 319, length 188
04:29:49.746496 IP lamp-s-1vcpu-1gb-tor1-01.ssh > dsl-173-206-219-44.tor.primus.ca.54505: Flags [P.], seq 14392:14580, ack 1, win 319, length 188
04:29:49.746630 IP lamp-s-1vcpu-1gb-tor1-01.ssh > dsl-173-206-219-44.tor.primus.ca.54505: Flags [P.], seq 14580:14768, ack 1, win 319, length 188
04:29:49.746783 IP lamp-s-1vcpu-1gb-tor1-01.ssh > dsl-173-206-219-44.tor.primus.ca.54505: Flags [P.], seq 14768:14956, ack 1, win 319, length 188
04:29:49.748120 IP lamp-s-1vcpu-1gb-tor1-01.ssh > dsl-173-206-219-44.tor.primus.ca.54505: Flags [P.], seq 14956:15144, ack 1, win 319, length 188
04:29:49.748275 IP lamp-s-1vcpu-1gb-tor1-01.ssh > dsl-173-206-219-44.tor.primus.ca.54505: Flags [P.], seq 15144:15332, ack 1, win 319, length 188
04:29:49.748425 IP lamp-s-1vcpu-1gb-tor1-01.ssh > dsl-173-206-219-44.tor.primus.ca.54505: Flags [P.], seq 15332:15520, ack 1, win 319, length 188
04:29:49.748548 IP lamp-s-1vcpu-1gb-tor1-01.ssh > dsl-173-206-219-44.tor.primus.ca.54505: Flags [P.], seq 15520:15708, ack 1, win 319, length 188
04:29:49.750352 IP lamp-s-1vcpu-1gb-tor1-01.ssh > dsl-173-206-219-44.tor.primus.ca.54505: Flags [P.], seq 15708:15896, ack 1, win 319, length 188
04:29:49.750560 IP lamp-s-1vcpu-1gb-tor1-01.ssh > dsl-173-206-219-44.tor.primus.ca.54505: Flags [P.], seq 15896:16084, ack 1, win 319, length 188
04:29:49.750712 IP lamp-s-1vcpu-1gb-tor1-01.ssh > dsl-173-206-219-44.tor.primus.ca.54505: Flags [P.], seq 16084:16272, ack 1, win 319, length 188
04:29:49.750831 IP lamp-s-1vcpu-1gb-tor1-01.ssh > dsl-173-206-219-44.tor.primus.ca.54505: Flags [P.], seq 16272:16460, ack 1, win 319, length 188
04:29:49.750938 IP lamp-s-1vcpu-1gb-tor1-01.ssh > dsl-173-206-219-44.tor.primus.ca.54505: Flags [P.], seq 16460:16648, ack 1, win 319, length 188
04:29:49.751042 IP lamp-s-1vcpu-1gb-tor1-01.ssh > dsl-173-206-219-44.tor.primus.ca.54505: Flags [P.], seq 16648:16836, ack 1, win 319, length 188
04:29:49.751164 IP lamp-s-1vcpu-1gb-tor1-01.ssh > dsl-173-206-219-44.tor.primus.ca.54505: Flags [P.], seq 16836:17024, ack 1, win 319, length 188
04:29:49.751268 IP lamp-s-1vcpu-1gb-tor1-01.ssh > dsl-173-206-219-44.tor.primus.ca.54505: Flags [P.], seq 17024:17212, ack 1, win 319, length 188
04:29:49.752499 IP lamp-s-1vcpu-1gb-tor1-01.ssh > dsl-173-206-219-44.tor.primus.ca.54505: Flags [P.], seq 17212:17400, ack 1, win 319, length 188
04:29:49.752727 IP lamp-s-1vcpu-1gb-tor1-01.ssh > dsl-173-206-219-44.tor.primus.ca.54505: Flags [P.], seq 17400:17588, ack 1, win 319, length 188
04:29:49.752861 IP lamp-s-1vcpu-1gb-tor1-01.ssh > dsl-173-206-219-44.tor.primus.ca.54505: Flags [P.], seq 17588:17776, ack 1, win 319, length 188
04:29:49.752977 IP lamp-s-1vcpu-1gb-tor1-01.ssh > dsl-173-206-219-44.tor.primus.ca.54505: Flags [P.], seq 17776:17964, ack 1, win 319, length 188
04:29:49.753113 IP lamp-s-1vcpu-1gb-tor1-01.ssh > dsl-173-206-219-44.tor.primus.ca.54505: Flags [P.], seq 17964:18152, ack 1, win 319, length 188
04:29:49.753285 IP lamp-s-1vcpu-1gb-tor1-01.ssh > dsl-173-206-219-44.tor.primus.ca.54505: Flags [P.], seq 18152:18340, ack 1, win 319, length 188
04:29:49.753429 IP lamp-s-1vcpu-1gb-tor1-01.ssh > dsl-173-206-219-44.tor.primus.ca.54505: Flags [P.], seq 18340:18528, ack 1, win 319, length 188
04:29:49.753542 IP lamp-s-1vcpu-1gb-tor1-01.ssh > dsl-173-206-219-44.tor.primus.ca.54505: Flags [P.], seq 18528:18716, ack 1, win 319, length 188
04:29:49.754492 IP lamp-s-1vcpu-1gb-tor1-01.ssh > dsl-173-206-219-44.tor.primus.ca.54505: Flags [P.], seq 18716:18904, ack 1, win 319, length 188
04:29:49.754657 IP lamp-s-1vcpu-1gb-tor1-01.ssh > dsl-173-206-219-44.tor.primus.ca.54505: Flags [P.], seq 18904:19092, ack 1, win 319, length 188
04:29:49.754802 IP lamp-s-1vcpu-1gb-tor1-01.ssh > dsl-173-206-219-44.tor.primus.ca.54505: Flags [P.], seq 19092:19280, ack 1, win 319, length 188
04:29:49.754940 IP lamp-s-1vcpu-1gb-tor1-01.ssh > dsl-173-206-219-44.tor.primus.ca.54505: Flags [P.], seq 19280:19468, ack 1, win 319, length 188
04:29:49.755048 IP lamp-s-1vcpu-1gb-tor1-01.ssh > dsl-173-206-219-44.tor.primus.ca.54505: Flags [P.], seq 19468:19656, ack 1, win 319, length 188
04:29:49.755155 IP lamp-s-1vcpu-1gb-tor1-01.ssh > dsl-173-206-219-44.tor.primus.ca.54505: Flags [P.], seq 19656:19844, ack 1, win 319, length 188
04:29:49.755264 IP lamp-s-1vcpu-1gb-tor1-01.ssh > dsl-173-206-219-44.tor.primus.ca.54505: Flags [P.], seq 19844:20032, ack 1, win 319, length 188
04:29:49.755410 IP lamp-s-1vcpu-1gb-tor1-01.ssh > dsl-173-206-219-44.tor.primus.ca.54505: Flags [P.], seq 20032:20220, ack 1, win 319, length 188
04:29:49.756453 IP lamp-s-1vcpu-1gb-tor1-01.ssh > dsl-173-206-219-44.tor.primus.ca.54505: Flags [P.], seq 20220:20408, ack 1, win 319, length 188
04:29:49.756601 IP lamp-s-1vcpu-1gb-tor1-01.ssh > dsl-173-206-219-44.tor.primus.ca.54505: Flags [P.], seq 20408:20596, ack 1, win 319, length 188
04:29:49.756717 IP lamp-s-1vcpu-1gb-tor1-01.ssh > dsl-173-206-219-44.tor.primus.ca.54505: Flags [P.], seq 20596:20784, ack 1, win 319, length 188
04:29:49.756826 IP lamp-s-1vcpu-1gb-tor1-01.ssh > dsl-173-206-219-44.tor.primus.ca.54505: Flags [P.], seq 20784:20972, ack 1, win 319, length 188
04:29:49.756930 IP lamp-s-1vcpu-1gb-tor1-01.ssh > dsl-173-206-219-44.tor.primus.ca.54505: Flags [P.], seq 20972:21160, ack 1, win 319, length 188
04:29:49.757036 IP lamp-s-1vcpu-1gb-tor1-01.ssh > dsl-173-206-219-44.tor.primus.ca.54505: Flags [P.], seq 21160:21348, ack 1, win 319, length 188
04:29:49.757176 IP lamp-s-1vcpu-1gb-tor1-01.ssh > dsl-173-206-219-44.tor.primus.ca.54505: Flags [P.], seq 21348:21536, ack 1, win 319, length 188
04:29:49.757287 IP lamp-s-1vcpu-1gb-tor1-01.ssh > dsl-173-206-219-44.tor.primus.ca.54505: Flags [P.], seq 21536:21724, ack 1, win 319, length 188
04:29:49.758416 IP lamp-s-1vcpu-1gb-tor1-01.ssh > dsl-173-206-219-44.tor.primus.ca.54505: Flags [P.], seq 21724:21912, ack 1, win 319, length 188
04:29:49.758587 IP lamp-s-1vcpu-1gb-tor1-01.ssh > dsl-173-206-219-44.tor.primus.ca.54505: Flags [P.], seq 21912:22100, ack 1, win 319, length 188
04:29:49.758735 IP lamp-s-1vcpu-1gb-tor1-01.ssh > dsl-173-206-219-44.tor.primus.ca.54505: Flags [P.], seq 22100:22288, ack 1, win 319, length 188
04:29:49.758846 IP lamp-s-1vcpu-1gb-tor1-01.ssh > dsl-173-206-219-44.tor.primus.ca.54505: Flags [P.], seq 22288:22476, ack 1, win 319, length 188
04:29:49.758964 IP lamp-s-1vcpu-1gb-tor1-01.ssh > dsl-173-206-219-44.tor.primus.ca.54505: Flags [P.], seq 22476:22664, ack 1, win 319, length 188
04:29:49.759086 IP lamp-s-1vcpu-1gb-tor1-01.ssh > dsl-173-206-219-44.tor.primus.ca.54505: Flags [P.], seq 22664:22852, ack 1, win 319, length 188
04:29:49.759211 IP lamp-s-1vcpu-1gb-tor1-01.ssh > dsl-173-206-219-44.tor.primus.ca.54505: Flags [P.], seq 22852:23040, ack 1, win 319, length 188
04:29:49.759379 IP lamp-s-1vcpu-1gb-tor1-01.ssh > dsl-173-206-219-44.tor.primus.ca.54505: Flags [P.], seq 23040:23228, ack 1, win 319, length 188
04:29:49.760623 IP lamp-s-1vcpu-1gb-tor1-01.ssh > dsl-173-206-219-44.tor.primus.ca.54505: Flags [P.], seq 23228:23416, ack 1, win 319, length 188
04:29:49.760829 IP lamp-s-1vcpu-1gb-tor1-01.ssh > dsl-173-206-219-44.tor.primus.ca.54505: Flags [P.], seq 23416:23604, ack 1, win 319, length 188
04:29:49.760959 IP lamp-s-1vcpu-1gb-tor1-01.ssh > dsl-173-206-219-44.tor.primus.ca.54505: Flags [P.], seq 23604:23792, ack 1, win 319, length 188
04:29:49.761098 IP lamp-s-1vcpu-1gb-tor1-01.ssh > dsl-173-206-219-44.tor.primus.ca.54505: Flags [P.], seq 23792:23980, ack 1, win 319, length 188
04:29:49.761213 IP lamp-s-1vcpu-1gb-tor1-01.ssh > dsl-173-206-219-44.tor.primus.ca.54505: Flags [P.], seq 23980:24168, ack 1, win 319, length 188
04:29:49.761322 IP lamp-s-1vcpu-1gb-tor1-01.ssh > dsl-173-206-219-44.tor.primus.ca.54505: Flags [P.], seq 24168:24356, ack 1, win 319, length 188
04:29:49.761428 IP lamp-s-1vcpu-1gb-tor1-01.ssh > dsl-173-206-219-44.tor.primus.ca.54505: Flags [P.], seq 24356:24544, ack 1, win 319, length 188
04:29:49.761534 IP lamp-s-1vcpu-1gb-tor1-01.ssh > dsl-173-206-219-44.tor.primus.ca.54505: Flags [P.], seq 24544:24732, ack 1, win 319, length 188
04:29:49.762593 IP lamp-s-1vcpu-1gb-tor1-01.ssh > dsl-173-206-219-44.tor.primus.ca.54505: Flags [P.], seq 24732:24920, ack 1, win 319, length 188
04:29:49.763197 IP lamp-s-1vcpu-1gb-tor1-01.ssh > dsl-173-206-219-44.tor.primus.ca.54505: Flags [P.], seq 24920:25108, ack 1, win 319, length 188
04:29:49.763387 IP lamp-s-1vcpu-1gb-tor1-01.ssh > dsl-173-206-219-44.tor.primus.ca.54505: Flags [P.], seq 25108:25296, ack 1, win 319, length 188
04:29:49.763541 IP lamp-s-1vcpu-1gb-tor1-01.ssh > dsl-173-206-219-44.tor.primus.ca.54505: Flags [P.], seq 25296:25484, ack 1, win 319, length 188
04:29:49.763674 IP lamp-s-1vcpu-1gb-tor1-01.ssh > dsl-173-206-219-44.tor.primus.ca.54505: Flags [P.], seq 25484:25672, ack 1, win 319, length 188
04:29:49.763839 IP lamp-s-1vcpu-1gb-tor1-01.ssh > dsl-173-206-219-44.tor.primus.ca.54505: Flags [P.], seq 25672:25860, ack 1, win 319, length 188
04:29:49.763959 IP lamp-s-1vcpu-1gb-tor1-01.ssh > dsl-173-206-219-44.tor.primus.ca.54505: Flags [P.], seq 25860:26048, ack 1, win 319, length 188
04:29:49.764068 IP lamp-s-1vcpu-1gb-tor1-01.ssh > dsl-173-206-219-44.tor.primus.ca.54505: Flags [P.], seq 26048:26236, ack 1, win 319, length 188
04:29:49.764638 IP lamp-s-1vcpu-1gb-tor1-01.ssh > dsl-173-206-219-44.tor.primus.ca.54505: Flags [P.], seq 26236:26424, ack 1, win 319, length 188
04:29:49.764824 IP lamp-s-1vcpu-1gb-tor1-01.ssh > dsl-173-206-219-44.tor.primus.ca.54505: Flags [P.], seq 26424:26612, ack 1, win 319, length 188
04:29:49.764954 IP lamp-s-1vcpu-1gb-tor1-01.ssh > dsl-173-206-219-44.tor.primus.ca.54505: Flags [P.], seq 26612:26800, ack 1, win 319, length 188
04:29:49.765065 IP lamp-s-1vcpu-1gb-tor1-01.ssh > dsl-173-206-219-44.tor.primus.ca.54505: Flags [P.], seq 26800:26988, ack 1, win 319, length 188
04:29:49.765200 IP lamp-s-1vcpu-1gb-tor1-01.ssh > dsl-173-206-219-44.tor.primus.ca.54505: Flags [P.], seq 26988:27176, ack 1, win 319, length 188
04:29:49.765311 IP lamp-s-1vcpu-1gb-tor1-01.ssh > dsl-173-206-219-44.tor.primus.ca.54505: Flags [P.], seq 27176:27364, ack 1, win 319, length 188
04:29:49.765419 IP lamp-s-1vcpu-1gb-tor1-01.ssh > dsl-173-206-219-44.tor.primus.ca.54505: Flags [P.], seq 27364:27552, ack 1, win 319, length 188
04:29:49.765527 IP lamp-s-1vcpu-1gb-tor1-01.ssh > dsl-173-206-219-44.tor.primus.ca.54505: Flags [P.], seq 27552:27740, ack 1, win 319, length 188
04:29:49.766564 IP lamp-s-1vcpu-1gb-tor1-01.ssh > dsl-173-206-219-44.tor.primus.ca.54505: Flags [P.], seq 27740:27928, ack 1, win 319, length 188
04:29:49.766797 IP lamp-s-1vcpu-1gb-tor1-01.ssh > dsl-173-206-219-44.tor.primus.ca.54505: Flags [P.], seq 27928:28116, ack 1, win 319, length 188
04:29:49.766932 IP lamp-s-1vcpu-1gb-tor1-01.ssh > dsl-173-206-219-44.tor.primus.ca.54505: Flags [P.], seq 28116:28304, ack 1, win 319, length 188
04:29:49.767042 IP lamp-s-1vcpu-1gb-tor1-01.ssh > dsl-173-206-219-44.tor.primus.ca.54505: Flags [P.], seq 28304:28492, ack 1, win 319, length 188
04:29:49.767186 IP lamp-s-1vcpu-1gb-tor1-01.ssh > dsl-173-206-219-44.tor.primus.ca.54505: Flags [P.], seq 28492:28680, ack 1, win 319, length 188
04:29:49.767357 IP lamp-s-1vcpu-1gb-tor1-01.ssh > dsl-173-206-219-44.tor.primus.ca.54505: Flags [P.], seq 28680:28868, ack 1, win 319, length 188
04:29:49.767489 IP lamp-s-1vcpu-1gb-tor1-01.ssh > dsl-173-206-219-44.tor.primus.ca.54505: Flags [P.], seq 28868:29056, ack 1, win 319, length 188
04:29:49.767600 IP lamp-s-1vcpu-1gb-tor1-01.ssh > dsl-173-206-219-44.tor.primus.ca.54505: Flags [P.], seq 29056:29244, ack 1, win 319, length 188
04:29:49.783191 IP lamp-s-1vcpu-1gb-tor1-01.ssh > dsl-173-206-219-44.tor.primus.ca.54505: Flags [P.], seq 29244:29432, ack 1, win 319, length 188
04:29:49.783499 IP lamp-s-1vcpu-1gb-tor1-01.ssh > dsl-173-206-219-44.tor.primus.ca.54505: Flags [P.], seq 29432:29620, ack 1, win 319, length 188
04:29:49.783629 IP lamp-s-1vcpu-1gb-tor1-01.ssh > dsl-173-206-219-44.tor.primus.ca.54505: Flags [P.], seq 29620:29808, ack 1, win 319, length 188
04:29:49.783746 IP lamp-s-1vcpu-1gb-tor1-01.ssh > dsl-173-206-219-44.tor.primus.ca.54505: Flags [P.], seq 29808:29996, ack 1, win 319, length 188
04:29:49.783865 IP lamp-s-1vcpu-1gb-tor1-01.ssh > dsl-173-206-219-44.tor.primus.ca.54505: Flags [P.], seq 29996:30184, ack 1, win 319, length 188
04:29:49.783974 IP lamp-s-1vcpu-1gb-tor1-01.ssh > dsl-173-206-219-44.tor.primus.ca.54505: Flags [P.], seq 30184:30372, ack 1, win 319, length 188
04:29:49.784081 IP lamp-s-1vcpu-1gb-tor1-01.ssh > dsl-173-206-219-44.tor.primus.ca.54505: Flags [P.], seq 30372:30560, ack 1, win 319, length 188
04:29:49.784187 IP lamp-s-1vcpu-1gb-tor1-01.ssh > dsl-173-206-219-44.tor.primus.ca.54505: Flags [P.], seq 30560:30748, ack 1, win 319, length 188
04:29:49.785037 IP lamp-s-1vcpu-1gb-tor1-01.ssh > dsl-173-206-219-44.tor.primus.ca.54505: Flags [P.], seq 30748:30936, ack 1, win 319, length 188
04:29:49.785214 IP lamp-s-1vcpu-1gb-tor1-01.ssh > dsl-173-206-219-44.tor.primus.ca.54505: Flags [P.], seq 30936:31124, ack 1, win 319, length 188
04:29:49.785339 IP lamp-s-1vcpu-1gb-tor1-01.ssh > dsl-173-206-219-44.tor.primus.ca.54505: Flags [P.], seq 31124:31312, ack 1, win 319, length 188
04:29:49.785452 IP lamp-s-1vcpu-1gb-tor1-01.ssh > dsl-173-206-219-44.tor.primus.ca.54505: Flags [P.], seq 31312:31500, ack 1, win 319, length 188
04:29:49.787318 IP lamp-s-1vcpu-1gb-tor1-01.ssh > dsl-173-206-219-44.tor.primus.ca.54505: Flags [P.], seq 31500:31688, ack 1, win 319, length 188
04:29:49.787495 IP lamp-s-1vcpu-1gb-tor1-01.ssh > dsl-173-206-219-44.tor.primus.ca.54505: Flags [P.], seq 31688:31876, ack 1, win 319, length 188
04:29:49.787620 IP lamp-s-1vcpu-1gb-tor1-01.ssh > dsl-173-206-219-44.tor.primus.ca.54505: Flags [P.], seq 31876:32064, ack 1, win 319, length 188
04:29:49.787733 IP lamp-s-1vcpu-1gb-tor1-01.ssh > dsl-173-206-219-44.tor.primus.ca.54505: Flags [P.], seq 32064:32252, ack 1, win 319, length 188
04:29:49.789556 IP lamp-s-1vcpu-1gb-tor1-01.ssh > dsl-173-206-219-44.tor.primus.ca.54505: Flags [P.], seq 32252:32440, ack 1, win 319, length 188
04:29:49.789751 IP lamp-s-1vcpu-1gb-tor1-01.ssh > dsl-173-206-219-44.tor.primus.ca.54505: Flags [P.], seq 32440:32628, ack 1, win 319, length 188
04:29:49.789882 IP lamp-s-1vcpu-1gb-tor1-01.ssh > dsl-173-206-219-44.tor.primus.ca.54505: Flags [P.], seq 32628:32816, ack 1, win 319, length 188
04:29:49.790091 IP lamp-s-1vcpu-1gb-tor1-01.ssh > dsl-173-206-219-44.tor.primus.ca.54505: Flags [P.], seq 32816:33004, ack 1, win 319, length 188
04:29:49.791481 IP lamp-s-1vcpu-1gb-tor1-01.ssh > dsl-173-206-219-44.tor.primus.ca.54505: Flags [P.], seq 33004:33192, ack 1, win 319, length 188
04:29:49.791637 IP lamp-s-1vcpu-1gb-tor1-01.ssh > dsl-173-206-219-44.tor.primus.ca.54505: Flags [P.], seq 33192:33380, ack 1, win 319, length 188
04:29:49.791751 IP lamp-s-1vcpu-1gb-tor1-01.ssh > dsl-173-206-219-44.tor.primus.ca.54505: Flags [P.], seq 33380:33568, ack 1, win 319, length 188
04:29:49.791857 IP lamp-s-1vcpu-1gb-tor1-01.ssh > dsl-173-206-219-44.tor.primus.ca.54505: Flags [P.], seq 33568:33756, ack 1, win 319, length 188
04:29:49.791962 IP lamp-s-1vcpu-1gb-tor1-01.ssh > dsl-173-206-219-44.tor.primus.ca.54505: Flags [P.], seq 33756:33944, ack 1, win 319, length 188
04:29:49.792066 IP lamp-s-1vcpu-1gb-tor1-01.ssh > dsl-173-206-219-44.tor.primus.ca.54505: Flags [P.], seq 33944:34132, ack 1, win 319, length 188
04:29:49.792174 IP lamp-s-1vcpu-1gb-tor1-01.ssh > dsl-173-206-219-44.tor.primus.ca.54505: Flags [P.], seq 34132:34320, ack 1, win 319, length 188
04:29:49.792284 IP lamp-s-1vcpu-1gb-tor1-01.ssh > dsl-173-206-219-44.tor.primus.ca.54505: Flags [P.], seq 34320:34508, ack 1, win 319, length 188
04:29:49.793451 IP lamp-s-1vcpu-1gb-tor1-01.ssh > dsl-173-206-219-44.tor.primus.ca.54505: Flags [P.], seq 34508:34696, ack 1, win 319, length 188
04:29:49.793705 IP lamp-s-1vcpu-1gb-tor1-01.ssh > dsl-173-206-219-44.tor.primus.ca.54505: Flags [P.], seq 34696:34884, ack 1, win 319, length 188
04:29:49.793840 IP lamp-s-1vcpu-1gb-tor1-01.ssh > dsl-173-206-219-44.tor.primus.ca.54505: Flags [P.], seq 34884:35072, ack 1, win 319, length 188
04:29:49.793954 IP lamp-s-1vcpu-1gb-tor1-01.ssh > dsl-173-206-219-44.tor.primus.ca.54505: Flags [P.], seq 35072:35260, ack 1, win 319, length 188
04:29:49.794060 IP lamp-s-1vcpu-1gb-tor1-01.ssh > dsl-173-206-219-44.tor.primus.ca.54505: Flags [P.], seq 35260:35448, ack 1, win 319, length 188
04:29:49.794166 IP lamp-s-1vcpu-1gb-tor1-01.ssh > dsl-173-206-219-44.tor.primus.ca.54505: Flags [P.], seq 35448:35636, ack 1, win 319, length 188
04:29:49.794270 IP lamp-s-1vcpu-1gb-tor1-01.ssh > dsl-173-206-219-44.tor.primus.ca.54505: Flags [P.], seq 35636:35824, ack 1, win 319, length 188
04:29:49.794374 IP lamp-s-1vcpu-1gb-tor1-01.ssh > dsl-173-206-219-44.tor.primus.ca.54505: Flags [P.], seq 35824:36012, ack 1, win 319, length 188
04:29:49.795422 IP lamp-s-1vcpu-1gb-tor1-01.ssh > dsl-173-206-219-44.tor.primus.ca.54505: Flags [P.], seq 36012:36200, ack 1, win 319, length 188
04:29:49.795603 IP lamp-s-1vcpu-1gb-tor1-01.ssh > dsl-173-206-219-44.tor.primus.ca.54505: Flags [P.], seq 36200:36388, ack 1, win 319, length 188
04:29:49.795740 IP lamp-s-1vcpu-1gb-tor1-01.ssh > dsl-173-206-219-44.tor.primus.ca.54505: Flags [P.], seq 36388:36576, ack 1, win 319, length 188
04:29:49.795873 IP lamp-s-1vcpu-1gb-tor1-01.ssh > dsl-173-206-219-44.tor.primus.ca.54505: Flags [P.], seq 36576:36764, ack 1, win 319, length 188
04:29:49.796002 IP lamp-s-1vcpu-1gb-tor1-01.ssh > dsl-173-206-219-44.tor.primus.ca.54505: Flags [P.], seq 36764:36952, ack 1, win 319, length 188
04:29:49.796130 IP lamp-s-1vcpu-1gb-tor1-01.ssh > dsl-173-206-219-44.tor.primus.ca.54505: Flags [P.], seq 36952:37140, ack 1, win 319, length 188
04:29:49.796253 IP lamp-s-1vcpu-1gb-tor1-01.ssh > dsl-173-206-219-44.tor.primus.ca.54505: Flags [P.], seq 37140:37328, ack 1, win 319, length 188
04:29:49.796384 IP lamp-s-1vcpu-1gb-tor1-01.ssh > dsl-173-206-219-44.tor.primus.ca.54505: Flags [P.], seq 37328:37516, ack 1, win 319, length 188
04:29:49.797389 IP lamp-s-1vcpu-1gb-tor1-01.ssh > dsl-173-206-219-44.tor.primus.ca.54505: Flags [P.], seq 37516:37704, ack 1, win 319, length 188
04:29:49.797581 IP lamp-s-1vcpu-1gb-tor1-01.ssh > dsl-173-206-219-44.tor.primus.ca.54505: Flags [P.], seq 37704:37892, ack 1, win 319, length 188
04:29:49.797709 IP lamp-s-1vcpu-1gb-tor1-01.ssh > dsl-173-206-219-44.tor.primus.ca.54505: Flags [P.], seq 37892:38080, ack 1, win 319, length 188
04:29:49.797824 IP lamp-s-1vcpu-1gb-tor1-01.ssh > dsl-173-206-219-44.tor.primus.ca.54505: Flags [P.], seq 38080:38268, ack 1, win 319, length 188
04:29:49.797931 IP lamp-s-1vcpu-1gb-tor1-01.ssh > dsl-173-206-219-44.tor.primus.ca.54505: Flags [P.], seq 38268:38456, ack 1, win 319, length 188
04:29:49.798041 IP lamp-s-1vcpu-1gb-tor1-01.ssh > dsl-173-206-219-44.tor.primus.ca.54505: Flags [P.], seq 38456:38644, ack 1, win 319, length 188
04:29:49.798154 IP lamp-s-1vcpu-1gb-tor1-01.ssh > dsl-173-206-219-44.tor.primus.ca.54505: Flags [P.], seq 38644:38832, ack 1, win 319, length 188
04:29:49.798259 IP lamp-s-1vcpu-1gb-tor1-01.ssh > dsl-173-206-219-44.tor.primus.ca.54505: Flags [P.], seq 38832:39020, ack 1, win 319, length 188
04:29:49.799580 IP lamp-s-1vcpu-1gb-tor1-01.ssh > dsl-173-206-219-44.tor.primus.ca.54505: Flags [P.], seq 39020:39208, ack 1, win 319, length 188
04:29:49.799743 IP lamp-s-1vcpu-1gb-tor1-01.ssh > dsl-173-206-219-44.tor.primus.ca.54505: Flags [P.], seq 39208:39396, ack 1, win 319, length 188
04:29:49.799860 IP lamp-s-1vcpu-1gb-tor1-01.ssh > dsl-173-206-219-44.tor.primus.ca.54505: Flags [P.], seq 39396:39584, ack 1, win 319, length 188
04:29:49.799997 IP lamp-s-1vcpu-1gb-tor1-01.ssh > dsl-173-206-219-44.tor.primus.ca.54505: Flags [P.], seq 39584:39772, ack 1, win 319, length 188
04:29:49.800118 IP lamp-s-1vcpu-1gb-tor1-01.ssh > dsl-173-206-219-44.tor.primus.ca.54505: Flags [P.], seq 39772:39960, ack 1, win 319, length 188
04:29:49.800225 IP lamp-s-1vcpu-1gb-tor1-01.ssh > dsl-173-206-219-44.tor.primus.ca.54505: Flags [P.], seq 39960:40148, ack 1, win 319, length 188
04:29:49.800335 IP lamp-s-1vcpu-1gb-tor1-01.ssh > dsl-173-206-219-44.tor.primus.ca.54505: Flags [P.], seq 40148:40336, ack 1, win 319, length 188
04:29:49.800443 IP lamp-s-1vcpu-1gb-tor1-01.ssh > dsl-173-206-219-44.tor.primus.ca.54505: Flags [P.], seq 40336:40524, ack 1, win 319, length 188
04:29:49.801543 IP lamp-s-1vcpu-1gb-tor1-01.ssh > dsl-173-206-219-44.tor.primus.ca.54505: Flags [P.], seq 40524:40712, ack 1, win 319, length 188
04:29:49.801704 IP lamp-s-1vcpu-1gb-tor1-01.ssh > dsl-173-206-219-44.tor.primus.ca.54505: Flags [P.], seq 40712:40900, ack 1, win 319, length 188
04:29:49.801820 IP lamp-s-1vcpu-1gb-tor1-01.ssh > dsl-173-206-219-44.tor.primus.ca.54505: Flags [P.], seq 40900:41088, ack 1, win 319, length 188
04:29:49.801925 IP lamp-s-1vcpu-1gb-tor1-01.ssh > dsl-173-206-219-44.tor.primus.ca.54505: Flags [P.], seq 41088:41276, ack 1, win 319, length 188
04:29:49.802045 IP lamp-s-1vcpu-1gb-tor1-01.ssh > dsl-173-206-219-44.tor.primus.ca.54505: Flags [P.], seq 41276:41464, ack 1, win 319, length 188
04:29:49.802162 IP lamp-s-1vcpu-1gb-tor1-01.ssh > dsl-173-206-219-44.tor.primus.ca.54505: Flags [P.], seq 41464:41652, ack 1, win 319, length 188
04:29:49.802286 IP lamp-s-1vcpu-1gb-tor1-01.ssh > dsl-173-206-219-44.tor.primus.ca.54505: Flags [P.], seq 41652:41840, ack 1, win 319, length 188
04:29:49.802397 IP lamp-s-1vcpu-1gb-tor1-01.ssh > dsl-173-206-219-44.tor.primus.ca.54505: Flags [P.], seq 41840:42028, ack 1, win 319, length 188
04:29:49.803806 IP lamp-s-1vcpu-1gb-tor1-01.ssh > dsl-173-206-219-44.tor.primus.ca.54505: Flags [P.], seq 42028:42216, ack 1, win 319, length 188
04:29:49.803980 IP lamp-s-1vcpu-1gb-tor1-01.ssh > dsl-173-206-219-44.tor.primus.ca.54505: Flags [P.], seq 42216:42404, ack 1, win 319, length 188
04:29:49.804179 IP lamp-s-1vcpu-1gb-tor1-01.ssh > dsl-173-206-219-44.tor.primus.ca.54505: Flags [P.], seq 42404:42592, ack 1, win 319, length 188